{"edges": [], "ensembles": [{"commit_rights": false, "entry_condition": "pass", "entry_from_node": "start", "kind": "parallel", "members": [{}, {}, {}], "min_pass": 3, "name": "drafters", "on_pass_to": "implement", "prompt_template": "", "timeout_minutes": 30}], "format_version": 6, "name": "parallel-proposers", "nodes": [{"config": {}, "kind": "check", "name": "start", "position": 1}, {"config": {}, "kind": "agent", "name": "implement", "position": 2}]}
