{"edges": [{"condition": "pass", "from_node": "implement", "to_node": "gate"}, {"condition": "pass", "from_node": "gate", "to_node": "crosscheck"}, {"condition": "fail", "from_node": "gate", "to_node": "implement"}, {"condition": "pass", "from_node": "crosscheck", "to_node": "finish"}, {"condition": "fail", "from_node": "crosscheck", "to_node": "implement"}], "format_version": 6, "name": "cross-platform-check", "nodes": [{"config": {}, "kind": "agent", "name": "implement", "position": 1}, {"config": {}, "kind": "check", "name": "gate", "position": 2}, {"config": {}, "kind": "agent", "name": "crosscheck", "position": 3}, {"config": {}, "kind": "check", "name": "finish", "position": 4}]}
