{"edges": [{"condition": "pass", "from_node": "implement", "to_node": "gate"}, {"condition": "pass", "from_node": "gate", "to_node": "adversary"}, {"condition": "fail", "from_node": "adversary", "to_node": "implement"}, {"condition": "pass", "from_node": "adversary", "to_node": "review"}], "format_version": 6, "name": "adversarial-review", "nodes": [{"config": {}, "kind": "agent", "name": "implement", "position": 1}, {"config": {}, "kind": "check", "name": "gate", "position": 2}, {"config": {}, "kind": "agent", "name": "adversary", "position": 3}, {"config": {}, "kind": "agent", "name": "review", "position": 4}]}
