{"edges": [{"condition": "pass", "from_node": "github-issue", "to_node": "inbox-script"}, {"condition": "pass", "from_node": "inbox-script", "to_node": "watch"}, {"condition": "pass", "from_node": "watch", "to_node": "intake"}, {"condition": "pass", "from_node": "intake", "to_node": "implement"}, {"condition": "pass", "from_node": "implement", "to_node": "gate"}, {"condition": "pass", "from_node": "gate", "to_node": "review"}], "format_version": 6, "name": "event-intake", "nodes": [{"config": {}, "kind": "check", "name": "github-issue", "position": 1}, {"config": {}, "kind": "check", "name": "inbox-script", "position": 2}, {"config": {}, "kind": "gate", "name": "watch", "position": 3}, {"config": {}, "kind": "agent", "name": "intake", "position": 4}, {"config": {}, "kind": "agent", "name": "implement", "position": 5}, {"config": {}, "kind": "check", "name": "gate", "position": 6}, {"config": {}, "kind": "agent", "name": "review", "position": 7}]}
