{"edges": [{"condition": "pass", "from_node": "implement", "to_node": "gate"}], "ensembles": [{"commit_rights": false, "entry_condition": "pass", "entry_from_node": "gate", "kind": "parallel", "members": [{}, {}, {}, {}], "min_pass": 4, "name": "review-panel", "on_fail_to": "implement", "on_pass_to": "commit", "prompt_template": "", "timeout_minutes": 30}], "format_version": 6, "name": "review-panel", "nodes": [{"config": {}, "kind": "agent", "name": "implement", "position": 1}, {"config": {}, "kind": "check", "name": "gate", "position": 2}, {"config": {}, "kind": "agent", "name": "commit", "position": 3}]}
