{"edges": [{"condition": "pass", "from_node": "gate", "to_node": "review"}, {"condition": "fail", "from_node": "gate", "to_node": "start"}, {"condition": "fail", "from_node": "review", "to_node": "start"}, {"condition": "pass", "from_node": "resilience", "to_node": "start"}], "ensembles": [{"commit_rights": false, "entry_condition": "pass", "entry_from_node": "start", "kind": "cascade", "members": [{}, {}], "min_pass": 1, "name": "implementers", "on_fail_to": "resilience", "on_pass_to": "gate", "prompt_template": "", "timeout_minutes": 30}], "format_version": 6, "name": "resilient-members", "nodes": [{"config": {}, "kind": "check", "name": "start", "position": 1}, {"config": {}, "kind": "check", "name": "gate", "position": 2}, {"config": {}, "kind": "agent", "name": "review", "position": 3}, {"config": {}, "kind": "agent", "name": "resilience", "position": 4}]}
