{"edges": [{"condition": "pass", "from_node": "implement", "to_node": "gate"}, {"condition": "pass", "from_node": "gate", "to_node": "review"}, {"condition": "fail", "from_node": "gate", "to_node": "implement"}, {"condition": "fail", "from_node": "review", "to_node": "implement"}], "format_version": 6, "name": "deterministic-gates", "nodes": [{"config": {}, "kind": "agent", "name": "implement", "position": 1}, {"config": {}, "kind": "check", "name": "gate", "position": 2}, {"config": {}, "kind": "agent", "name": "review", "position": 3}]}
