{"edges": [{"condition": {"route": "simple"}, "from_node": "router", "to_node": "implement-cheap"}, {"condition": {"route": "complex"}, "from_node": "router", "to_node": "implement-expensive"}, {"condition": "pass", "from_node": "implement-cheap", "to_node": "gate"}, {"condition": "pass", "from_node": "implement-expensive", "to_node": "gate"}, {"condition": "pass", "from_node": "gate", "to_node": "review"}, {"condition": "fail", "from_node": "gate", "to_node": "implement-expensive"}, {"condition": "fail", "from_node": "implement-cheap", "to_node": "implement-expensive"}], "format_version": 6, "name": "task-router", "nodes": [{"config": {}, "kind": "router", "name": "router", "position": 1}, {"config": {}, "kind": "agent", "name": "implement-cheap", "position": 2}, {"config": {}, "kind": "agent", "name": "implement-expensive", "position": 3}, {"config": {}, "kind": "check", "name": "gate", "position": 4}, {"config": {}, "kind": "agent", "name": "review", "position": 5}]}
